{
  "specVersion": "1.0.0",
  "id": "ki:pkg:acme/quarterly-market-scan@1.0.0",
  "uuid": "a3f1c2d4-5b6e-4a7c-8d9e-0f1a2b3c4d5e",
  "name": "Quarterly Market Scan",
  "version": "1.0.0",
  "lifecycle": "active",
  "classification": "internal",
  "conformanceLevel": "minimal",
  "created": "2026-04-01T09:00:00Z",
  "owners": [
    {
      "name": "Strategy Team",
      "type": "organisation",
      "role": "owner"
    }
  ],
  "digests": {
    "executive": {
      "summary": "A structured scan of the market for Q2, capturing notable competitor moves, pricing shifts, and two emerging opportunities for the strategy team to evaluate."
    }
  }
}
